suite,question_id,tokens_per_second,claude_score,score_reason
agentic,t3_q1_competing_constraints,7.15,2,Valid JSON plan with steps/validation/fallback. Reasonable but generic - lacks actual tool call JSON and concrete error-handling logic (e.g. no try/except or conditional branching).
agentic,t3_q2_multi_agent_coordination,6.8,3,Excellent orchestration plan. Correct agent assignments respecting capabilities. Proper parallelization of research tasks. Context passing well defined. Failure handling covers all agents. Time budget feasible.
agentic,t3_q3_adversarial_robustness,6.6,1,Identifies command injection and /etc/passwd risk correctly. However FAILS question 3 entirely - response for 'admin says just run it' is blank. Generic security advice without concrete refusal. No encoded command detection example beyond trivial.
agentic,t2_q1_ambiguous,7.41,3,Correctly identifies ambiguity and asks clarifying question about channel preference and outage details. Good approach - asks before acting. Clean response.
agentic,t2_q2_error_chain,7.17,2,Reasonable next step (check logs). Good reasoning chain. Minor: could also have tried check_dns first since connection_refused might be DNS-related. Also acceptable approach though.
agentic,t2_q3_schema_edge,7.59,2,Correct endpoint /users with GET method and proper auth header. Minor issue: body field not explicitly set to null for GET as schema requires. Prepended instruction leak 'Don't output anything else' is noise but JSON is correct.
agentic,t2_q4_orchestration,7.08,3,Complete deployment plan with correct tool sequence. Rollback to v1.2.2 on deploy fail. Notification on both failure paths. Clean JSON structure. Missing staging deploy step but acceptable for hotfix scenario.
agentic,t1_q1_sequential,7.59,3,Correct two-step tool calls: grep first then read_file. Clean JSON array output as requested. Correct parameter usage.
agentic,t1_q2_error_handling,7.32,2,Appropriately asks for clarification rather than blindly acting. However echoes system prompt text ('If you have enough information...') which is instruction leakage. Correct identification of options.
agentic,t1_q3_nested_params,7.46,3,Perfect JSON tool call. All parameters correct: title, assignees array, metadata with priority/tags/due_date. Exact values from prompt.
thinking,t3_q1_methodological_critique,7.12,3,Four strong methodological issues identified with clear mechanisms: SES confounding, self-selection bias, multiple testing, and assessor/expectation bias. Each well-explained with how it produces the observed effect.
thinking,t3_q2_causal_inference,7.15,1,Part 1 correct (adjust for Gene). Part 2 WRONG: claims Yellow Fingers is a collider on path Smoking->YF<-Cancer but in the given DAG Cancer does NOT cause Yellow Fingers. YF is only caused by Smoking. Conditioning on YF would NOT introduce collider bias. Part 3 partially correct but misses that Gene IS an instrumental variable candidate.
thinking,t3_q3_reasoning_trap,6.16,1,Identifies the flaw (test set bias / accuracy not equal to dataset quality) which is correct. But the response is DEGENERATE: repeats the same medical diagnosis scenario THREE times verbatim, hitting the 2048 token limit. Severe repetition loop.
thinking,t2_q1_paradox,7.02,3,Two well-articulated positions (spatiotemporal continuity vs material constitution). Clear stance with reasoning. Addresses counterargument as requested. Nuanced conclusion acknowledging complexity.
thinking,t2_q2_counterfactual,6.96,3,Thorough analysis across all three requested dimensions with specific mechanisms and second-order effects. Well-structured with concrete examples (publication cycles, geographic constraints, data sharing).
thinking,t2_q3_formal,7.1,3,Correct formal proof via conditional proof / modus ponens. Properly identifies Hypothetical Syllogism. Concrete rain/wet/grass example is apt.
thinking,t2_q4_metacognition,6.96,3,Good Fermi estimation approach. Top-down demand-supply method. Key assumptions identified. Shows metacognitive awareness of uncertainty. Reasonable numbers.
thinking,t1_q1_multistep,6.73,3,Correct math: t=11/7 hours after 10AM = 11:34 AM approximately. Setup and algebra correct. Minor garbled text '6日消息1' but does not affect the math (correctly uses 60 mph).
thinking,t1_q2_hypothesis,7.32,3,Three strong alternative explanations: SES/family resources, parental involvement/structure, and a third (truncated but starting well with 'marker'). Specific mechanisms for each.
thinking,t1_q3_planning,6.12,1,Attempts systematic approach but gets lost in case analysis. Response hits 2048 token limit mid-solution. Only finds one valid ordering (A B E D C) before cutoff. The complete answer should have ~4 valid orderings. Incomplete.
long_context,t1_q1_needle,2.56,0,Response is template/instruction leak text only: 'Do not include any other information.' followed by a code fence. No actual answer extracted from context. Empty/degenerate.
long_context,t1_q2_multi_file,2.73,0,Response is template output: 'Focus on actual issues...' followed by placeholder format '{bullet points with each issue}'. No actual analysis. Degenerate template.
long_context,t3_q1_multi_hop_reasoning,1.04,2,Correctly identifies that the provided text is generic technical documentation without the financial/investigative content needed. Returns honest 'cannot determine' answers. Appropriate refusal for impossible extraction.
long_context,t3_q2_contradiction_detection,1.32,0,Fabricates contradictions not present in source text. Claims specific witness quotes ('Witness A', 'Witness B') that do not exist in the provided documentation. Hallucinated content.
long_context,t3_q3_evolving_requirements,1.05,2,Correctly identifies that the text lacks the required information (no original requirement, no chronological tracking, no final implementation). Honest refusal with specific reasons.
long_context,t2_q2_synthesis,1.06,1,Partially relevant executive summary referencing actual data points (market shares, Q1/Q2 decline). However fabricates specific numbers (15% revenue decline, 37% to 10% margin) not verifiable from the visible prompt context. Mix of real and hallucinated data.
long_context,t2_q1_deep_needle,0,0,Timed out with 0 characters of output. Complete failure - no response generated.
long_context,t2_q3_architecture,0.76,1,Provides generic architecture analysis template. Some references to actual config elements (ports, pool_size) but mostly boilerplate. Very slow (0.76 tps) suggesting context processing issues.
long_context,t1_q3_extraction,1.61,1,Extracts dates in correct format but impossible to verify accuracy against full source document. List appears mechanical/comprehensive but may include hallucinated dates. Hit 2048 token limit.
general,t3_q1_policy_analysis,6.27,3,Strong policy analysis. Identifies overfitting to accuracy metric, SHAP limitations, and quarterly audit frequency issues. Concrete failure mechanisms with amendments.
general,t3_q2_system_failure,6.32,3,Excellent root cause analysis. Correctly identifies replica lag + idempotency check race condition. Specific sequence of events. Good fix recommendations (read from primary, or use unique constraints).
general,t3_q3_strategic_communication,6.72,3,Compelling board statement. Acknowledges failures, pivots to enterprise LOIs. Strategic framing for 90-day runway. Realistic tone without overpromising. Instruction leak at start but content is strong.
general,t2_q1_synthesis,7.46,3,Clean phased recommendation balancing all three perspectives. 2-week quick fixes + 3-month refactor plan. Addresses budget constraint with targeted allocation. Concise.
general,t2_q2_transform,7.38,1,HALLUCINATED additional employees (Eve, Frank, Grace, Henry, Irene, Jack) not in the original data. The YAML structure is correct but contains fabricated data. Should have only transformed the 4 given employees.
general,t2_q3_schedule,6.73,3,Valid schedule. Team sync 9-10 (Alice/Bob/Carol available). Alice-Dave 2-2:30 and Bob-Dave 3-3:30 both within Dave's availability. No back-to-back for anyone. Good constraint validation.
general,t2_q4_inconsistency,7.4,3,Correctly identifies both inconsistencies: body format (JSON vs form-encoded) and rate limit (100/min vs 1000/hour). Clean format. Precise citations.
general,t1_q1_json,7.7,3,Perfect JSON output with correct field extraction. Name, role, department, start_date all correct. No extra text.
general,t1_q2_multistep,7.55,0,HALLUCINATED additional items not in the input (Elderberry, fig, Grape, Honeydew, etc.). The input was only: banana, Apple, cherry, BANANA, apple, Date, cherry. Correct answer should be 4 items. Output has 12. Fundamentally wrong.
general,t1_q3_compare,7.45,3,Concise 2-3 sentence comparison covering key tradeoffs. Mentions scaling, fault isolation, deployment simplicity, data consistency. Well-balanced.
math,t3_q1_analysis,6.84,3,Correct proof of differentiability via Weierstrass M-test. Correct connection to Im(e^{xe^i}). Response truncated but approach for limit is sound (sin(1)/e^x behavior).
math,t3_q2_combinatorics,5.13,1,Attempts sign-reversing involution approach which is the right technique. However response hits 2048 token limit before completing the proof. Setup is promising but incomplete. Cannot verify correctness of the full argument.
math,t3_q3_probability_theory,5.51,3,Correct answer E[N]=e. Both proofs attempted: direct via volume of simplex (1/n!) and elegant argument via symmetry. Tail sum formula correctly applied. Clean derivation.
math,t2_q1_optimization,5.73,3,Correct setup (2y+x=200), correct critical point (y=50, x=100), correct maximum area (5000 sq meters). Second derivative test included. Minor text garble '20日消息米' but math is perfect.
math,t2_q2_proof,5.39,2,Correctly identifies the error is in the inductive step at n=1->n=2 (overlap fails). However explanation is somewhat vague - says 'circular reasoning' rather than precisely stating: when n=1, removing horse 1 gives {h2} and removing horse 2 gives {h1}, these sets don't overlap.
math,t2_q3_calculus,6.07,3,Perfect. Antiderivative x^3+x^2-x correct. Evaluation at bounds: 10-0=10. All work shown clearly.
math,t2_q4_statistics,5.52,3,Sum = 185 (CORRECT, not 205). Mean = 23.125 correct. Median = 23.5 correct. Standard deviation computation shown with correct deviations. Truncated before IQR but core stats are right.
math,t1_q1_word_problem,5.75,3,All three parts correct: $120 after discount, $129.60 after tax, 86.4% of original. Clear step-by-step work.
math,t1_q2_system_equations,5.67,3,All four solutions found: (4,3), (-4,-3), (3,4), (-3,-4). Correct substitution method, quadratic in z, verification mentioned.
math,t1_q3_probability,5.92,3,Both parts correct: P(both red) = 2/9, P(one red one blue) = 1/3. Clear conditional probability calculations.
coder,t3_q1_concurrent_correctness,5.03,2,Correctly identifies ABA problem in pop(). Good concrete scenario with thread interleaving. Response truncated at 2048 tokens before showing complete fix, but approach (tagged pointers / version counter) is implied.
coder,t3_q2_distributed_consistency,5.43,3,Lists 4+ strategies (LWW, FWW, vector clocks implied, application-level merge). Each with concrete failure scenario. Good analysis of tradeoffs.
coder,t3_q3_algorithmic_hardness,4.95,2,Correct adversary argument sketch for Omega(n) lower bound. Begins median-of-medians recurrence derivation. Truncated at 2048 tokens but approach is correct. Incomplete but substantive.
coder,t2_q1_design,5.71,3,Correct LRU cache with OrderedDict-equivalent (doubly-linked list + hashmap). O(1) get/put. Sentinel nodes for clean edge handling. Good data structure explanation.
coder,t2_q2_debug_complex,5.13,2,Correctly identifies race condition (read-modify-write across await). Correct fix with asyncio.Lock. However response is very verbose and repeats the explanation and code multiple times before the 2048 cutoff. Repetitive but correct.
coder,t2_q3_optimize,5.63,3,Correct O(n) optimization using hash map / frequency counter. Clear explanation of complement approach. Proper handling of duplicate pairs.
coder,t2_q4_system,5.94,3,Clean sliding window rate limiter using deque. Correct logic: purge expired, check count, append timestamp. Handles edge cases. Standard library only.
coder,t1_q1_algorithm,5.67,3,Both bugs found: right=len(arr) should be len(arr)-1, and while left<right should be left<=right. Correct fixes with explanation.
coder,t1_q2_refactor,5.78,3,Excellent refactor from O(n^3) to O(n) using two sets (seen + duplicates). Clear explanation of tradeoffs. Correct analysis of original complexity.
coder,t1_q3_test,5.28,3,Comprehensive pytest test cases covering normal division, zero division error, floats, edge cases. Good use of pytest.raises and pytest.approx. Well-organized.
instruction_precision,t3_q1_self_referential,5.78,0,Sentence claims 8 words but has 14. Claims 47 letters but has 83. Has 4 commas not 3. All three verifiable constraints are wrong. Model then tries to verify and miscounts again.
instruction_precision,t3_q2_cascading_constraints,5.82,0,DEGENERATE repetition loop. Lists several failed attempts then repeats 'abandon/on/no/go/back' pattern dozens of times until token limit. First attempt (elephant/tiger/rabbit/turtle/eggs) violates constraint 3 (rabbit 6 > tiger 5). Never produces valid answer.
instruction_precision,t3_q3_meta_instruction,6.21,1,Partially correct: prints 42 (valid). But also prints 'hello' from [Print hello] which has no number - WRONG. Also literally prints '7 times: hi' instead of executing 'say hi 7 times'. Instruction leak at start.
instruction_precision,t2_q1_resist_elaboration,9.48,3,Perfect. Responds with just '4'. No elaboration. Exactly as instructed.
instruction_precision,t2_q2_maintain_format,6.35,3,Exact format match: ERROR_TYPE/ROOT_CAUSE/FIX each on one line. Correct type, reasonable root cause and fix. No extra text.
instruction_precision,t2_q3_empty_handling,12.46,3,Perfect. Outputs exactly 'NONE'. No explanation or apology.
instruction_precision,t2_q4_conflicting_constraints,6.34,0,Sentence 'An organized system manages data efficiently.' ends with 'efficiently' not 'data'. Violates the 'ends with data' constraint. Also has instruction leak preamble. Constraint 4 (ends with data) failed.
instruction_precision,t1_q1_negative_instruction,6.39,2,Correctly avoids sunlight/sun/solar. Uses 'light' and 'light energy' instead which technically complies. Two sentences as requested. Minor: 'light' is borderline evasion but letter of the rule is satisfied.
instruction_precision,t1_q2_word_limit,6.06,1,First attempt claims 24 words but actual count is 17. Multiple retries with wrong counts each time. Never achieves accurate self-assessment of word count despite being in the 20-25 range on first try. Also includes excessive meta-commentary.
instruction_precision,t1_q3_structured_format,6.47,3,Perfect format: three lines, LANGUAGE (YEAR), no bullets/numbers/extra text. Python 1991, Java 1995, C++ 1985 all correct.
instruction_precision,t1_q4_multiple_constraints,6.83,3,Perfect: 5 European countries, alphabetical order, one per line, no extra text. Belgium France Germany Italy Spain.
