suite,question_id,tokens_per_second,claude_score,score_reason
math,t3_q1_analysis,2.79,2,"Correct on all 3 parts: proves differentiability via Weierstrass M-test, derives closed form f(x)=e^(x cos1) sin(x sin1) correctly, and finds limit=0 with valid reasoning. Minor issues: response echoes prompt at start; limit justification is incomplete (cut off at 2047 tokens) but directional reasoning is correct. Loses 1 point for truncation preventing full rigorous justification of part 3."
math,t3_q2_combinatorics,2.75,0,"Response fails to produce a valid proof. It explores multiple combinatorial interpretations but never arrives at a correct bijective or sign-reversing involution argument. The inclusion-exclusion interpretation attempted leads to a contradiction (count=1 vs RHS=C(n,floor(n/2))). The generating function approach is abandoned mid-stream. The response is essentially extended exploratory reasoning that hits the 2047 token limit without reaching a conclusion. No correct proof provided."
math,t3_q3_probability_theory,2.85,3,"Fully correct. E[N]=e is the right answer. Both proofs are provided: (a) direct calculation using P(S_n<=1)=1/n! (volume of n-simplex) and E[N]=sum 1/n!=e; (b) geometric argument using n-simplex volume. The response is clear, well-structured, and mathematically rigorous. Minor redundancy in restating proofs but all content is correct."
math,t2_q1_optimization,2.8,1,"The mathematical content is correct: x=100m, y=50m, area=5000 sq m. However, the response degenerates into severe repetition after the initial correct solution. From line ~260 onward, the same statements ('Thus answer', 'Now produce final answer', 'We'll also mention...') repeat hundreds of times until the 2047 token limit. This is a degenerate repetition loop. The correct answer is present but the response quality is severely degraded."
math,t2_q2_proof,2.76,2,"Correctly identifies the error: the inductive step fails at n=1 (n+1=2) because the two groups of 1 horse do not overlap. Correctly explains that for n>=2, the groups share at least one horse. All three sub-questions answered correctly. However, the response is excessively repetitive - restating the same answer multiple times. The mathematical content is fully correct despite the verbosity."
math,t2_q3_calculus,3.43,3,"Fully correct. Antiderivative x^3+x^2-x is correct. F(2)=10, F(0)=0, integral=10. All steps shown clearly. Includes verification. Clean and well-structured response with no errors."
math,t2_q4_statistics,3.01,2,"Mean=185/8=23.125 is correct (sum=185, verified step by step). Median=(22+25)/2=23.5 correct. Standard deviation computation is correct (432.875/8=54.109375, sqrt approx 7.356). Q1=16.5, Q3=29, IQR=12.5, bounds [-2.25,47.75], no outliers - all correct. Hit 2047 token limit during alternative variance calculation. Minor issue: truncated before completing alternative verification, but all requested calculations are correct."
math,t1_q1_word_problem,3.52,1,"All three answers are correct: $120 after discount, $129.60 after tax, 86.4% of original. However, the response degenerates into extreme repetition after the correct solution. Lines 1117-1713+ are endless loops of 'Thus answer / We'll produce final answer / We'll also show the percentage' repeated hundreds of times. This is a degenerate repetition loop. The correct answer is buried in the noise."
math,t1_q2_system_equations,3.61,3,"Fully correct. Finds all 4 real solutions: (4,3), (3,4), (-4,-3), (-3,-4). Shows two methods: substitution leading to quadratic u^2-25u+144=0, and algebraic identity method using (x+y)^2=49 and (x-y)^2=1. Both methods yield same solutions. Well-structured, clear, verified. No errors."
math,t1_q3_probability,3.32,1,"Both answers are correct: P(both red)=2/9, P(one red one blue)=1/3. Shows both sequential and combinatorial methods. However, the response degenerates into extreme repetition after the correct solution: 'We'll also show that the probability of both red is 2/9, and the probability of one red and one blue is 1/3' repeated 50+ times until token limit. Degenerate repetition loop."
coder,t3_q1_concurrent_correctness,3.19,2,"Correctly identifies the ABA problem in lock-free stack. Provides a concrete sequence of operations with threads T1/T2. Correctly explains incorrect behavior (lost nodes). Provides tagged pointer fix with code (pack/unpack pointer+tag, CAS on combined value). Also discusses hazard pointers as alternative. Minor issues: response is exploratory/draft-like in tone; code uses C++ idioms correctly but some details are informal. Hit token limit before final polished answer but all 4 requested parts are addressed with correct content."
coder,t3_q2_distributed_consistency,3.86,1,"Lists conflict resolution strategies (LWW, MV-Register, CRDT OR-Set, Quorum-based) with surprising-behavior scenarios. However, the response is cut off at 2047 tokens before completing parts 3 and 4 (shopping cart recommendation and banking ledger recommendation). Only parts 1-2 are partially addressed. The exploratory reasoning style means much token budget is spent on planning rather than delivering answers. Incomplete."
coder,t3_q3_algorithmic_hardness,3.07,1,"Attempts all 3 parts but none are completed. Part 1 (adversary argument for Omega(n) lower bound) is not actually proven - just mentioned. Part 2 (median-of-medians recurrence) is not derived - the response immediately pivots to order-statistic trees. Part 3 (randomized select analysis) attempts the recurrence but hits token limit mid-derivation. The response spends excessive tokens on order-statistic tree analysis (not clearly requested) and on speculative reasoning. No part is completed to satisfaction."
coder,t2_q1_design,2.92,0,"No actual code is provided. The entire response is a planning/discussion of what to include, degenerating into extreme repetition: 'We'll also discuss that we can include a method to...' repeated dozens of times for every conceivable method. No LRU cache class is implemented. No data structure choices are explained with actual code. This is a degenerate repetition loop with no substantive deliverable."
