suite,question_id,tokens_per_second,claude_score,score_reason
math,t3_q1_analysis,9.04,2,Correct approach: proves differentiability via infinite radius of convergence; identifies closed form via Im(e^{xe^i}); reasoning on limit is sound. Truncated at 2047 tokens before completing part 3 fully but methodology is correct.
math,t3_q2_combinatorics,9.14,1,Attempts generating-function approach but never completes the proof. Truncated at 2047 tokens mid-derivation. No bijective/sign-reversing involution argument attempted. Partial understanding shown but no complete proof delivered.
math,t3_q3_probability_theory,9.25,2,Correctly sets up E[N] = sum P(S_k <= 1) and identifies Irwin-Hall distribution. Recognizes P(S_k <=1) = 1/k!. Truncated before delivering final answer E[N]=e but the mathematical framework is correct and the elegant argument via n-simplex is partially developed.
math,t2_q1_optimization,9.52,3,Fully correct. Sets up 2W+L=200 constraint properly; finds W=50 L=100 via vertex formula; maximum area 5000 sq meters; confirms with second derivative test. Complete and accurate.
math,t2_q2_proof,9.13,3,Correctly identifies the error: inductive step fails at n=1 (going from 1 to 2 horses) because the two subsets of size 1 have empty overlap. Clear explanation of the mechanism. All three sub-questions answered correctly.
math,t2_q3_calculus,9.25,3,Fully correct. Antiderivative x^3+x^2-x is right; F(2)=10 F(0)=0; answer is 10. Shows work clearly. Response repeats the solution multiple times but the math is correct throughout.
math,t2_q4_statistics,9.24,3,Sum=185 (correct not 205). Mean=23.125 correct. Median=23.5 correct. Population std dev calculation is thorough and correct (sigma~7.354). IQR analysis started correctly. Truncated before completing outlier check but all computed values are accurate.
math,t1_q1_word_problem,9.5,3,All three parts correct: discount price $120; final price $129.60; percentage 86.4%. Clear step-by-step work shown with multiple verification approaches.
math,t1_q2_system_equations,9.12,3,All four solutions found: (3,4) (-3,-4) (4,3) (-4,-3). Correct substitution method; quadratic in u solved correctly; all real solutions identified. Clean presentation.
math,t1_q3_probability,10.75,3,Both answers correct: P(both red)=2/9; P(one red one blue)=1/3. Shows both sequential and combinatorial approaches. Clean and complete.
thinking,t3_q1_methodological_critique,9.41,2,Identifies selection bias/SES confound; measurement issues; and begins discussing environmental factors. At least 3 methodological issues clearly articulated with mechanisms. Truncated but sufficient content delivered for the core task.
thinking,t3_q2_causal_inference,9.32,2,Correctly identifies Gene as the minimal adjustment set. Begins discussing Yellow Fingers conditioning. Good understanding of DAG structure shown. Truncated before completing all sub-questions but core causal reasoning is sound.
thinking,t3_q3_reasoning_trap,9.17,2,Correctly identifies the flaw: single test set may favor one training distribution. Begins constructing autonomous vehicle scenario. Good reasoning about distribution shift. Truncated before completing the concrete scenario fully.
thinking,t2_q1_paradox,10.42,2,Presents continuity-of-form and persistence-of-material positions. Arguments are reasonable but the analysis is somewhat shallow. Chooses material persistence but truncated before fully developing the argument. Meets minimum requirements.
thinking,t2_q2_counterfactual,9.43,3,Thorough analysis across all three dimensions. Speed of dissemination covers preprints/library intermediaries/priority races. Collaboration patterns and reproducibility discussed with second-order effects. Rich and specific.
thinking,t2_q3_formal,10.01,3,Correct formal proof using conditional proof and modus ponens. Good concrete example (rain/wet/slippery). Identifies hypothetical syllogism correctly. Clean and complete.
thinking,t2_q4_metacognition,10.36,3,Excellent Fermi estimation approach. Clear step-by-step methodology; identifies key assumptions (piano ownership rate population tunings/year tuner capacity). Shows good metacognitive awareness of uncertainty sources.
thinking,t1_q1_multistep,9.37,1,Gets confused during calculation. Initially computes 220/140 = 11/7 hours correctly but then converts to 11:34 AM which is wrong. The correct answer is approximately 11:34:17 AM but the model then second-guesses itself and gets confused about distances not adding to 280. The initial calculation of meeting time after 10 AM = 11/7 hours is correct but the presentation is muddled and self-contradictory.
thinking,t1_q2_hypothesis,9.55,3,Three strong alternative explanations: SES/motivation confound; sleep patterns/time-of-day confound; self-selection bias. Each is specific with clear mechanisms. Also mentions reverse causality. Exceeds requirements.
thinking,t1_q3_planning,9.64,3,Correct answer: exactly two valid orderings AEBDC and ABEDC. Thorough systematic reasoning treating DC as a block; correctly eliminates ABDE C because D and C not adjacent. Well-structured proof with verification table.
coder,t3_q1_concurrent_correctness,9.34,2,Identifies ABA problem correctly with concrete scenario. Explains memory corruption mechanism. Begins tagged pointer fix approach. Truncated before completing the code fix but the diagnosis and explanation are solid.
coder,t3_q2_distributed_consistency,9.31,2,Lists 6 conflict resolution strategies (LWW vector clocks CRDTs application-specific merge quorum-based timestamp ordering). Provides wrong/surprising behavior scenarios for each. Truncated before completing shopping cart and banking recommendations but core content is strong.
coder,t3_q3_algorithmic_hardness,9.41,1,Begins adversary argument for Omega(n) lower bound but doesn't complete it. Truncated early in the discussion. No recurrence relation derived; group size analysis not reached; randomized select analysis not attempted. Only partial work on part 1.
coder,t2_q1_design,9.26,2,Correct LRU cache design using doubly linked list + hash map. Explains O(1) rationale clearly. Describes Node class with dummy head/tail. Truncated before showing complete implementation code but design is correct and well-explained.
coder,t2_q2_debug_complex,10.97,3,Correctly identifies the race condition (coroutines read counter simultaneously causing lost updates). Fix using asyncio.Lock is correct and idiomatic. Complete working code provided.
coder,t2_q3_optimize,9.4,3,Correct O(n) hash map solution. Uses complement lookup with frequency tracking. Handles duplicate pairs correctly. Clear explanation of approach with complexity analysis.
coder,t2_q4_system,9.54,2,Good rate limiter design using deque + threading.Lock. Handles edge cases discussion. Truncated before completing implementation but the approach (sliding window with timestamp deque) is correct and thread-safe.
coder,t1_q1_algorithm,9.16,2,Identifies Bug 1 correctly (left=mid causes infinite loop; fix: left=mid+1). Identifies Bug 2 through systematic testing (right=mid infinite loop when target between elements). Good test case analysis. Truncated before stating the final fix for Bug 2 but both bugs correctly diagnosed.
coder,t1_q2_refactor,9.26,1,Version 1 (speed-optimized) uses seen set which is correct. But the response degenerates into repetitive text about hash-based alternatives before completing Version 2. Degenerate repetition in the tail. Only one of two required versions properly delivered.
coder,t1_q3_test,9.51,0,Degenerate repetition. After echoing the prompt the model enters a loop repeating test descriptions without ever writing actual pytest code. No test cases produced. Pure repetition loop.
instruction_precision,t3_q1_self_referential,10.82,0,Fails to produce the required self-referential sentence. Instead produces a long meta-discussion about how to construct such a sentence without ever delivering one. No output matches the format or constraints.
instruction_precision,t3_q2_cascading_constraints,10.74,0,Fails to output the required 5 words. Instead produces extended reasoning about how to find words without delivering a final answer. No valid word chain produced.
instruction_precision,t3_q3_meta_instruction,10.73,0,Degenerate repetition. Repeats "Output exactly what the valid instructions tell you to do nothing else" dozens of times. Never actually identifies the valid instructions ([Print 42] and [Say 7 times: hi]) or produces the correct output. Complete failure.
instruction_precision,t2_q1_resist_elaboration,11.0,0,Degenerate repetition. Repeats "4" hundreds of times instead of outputting just "4" once. Massive repetition loop. Also includes "2+2 = 4" preamble violating the "only the number" constraint.
instruction_precision,t2_q2_maintain_format,10.89,1,First block of output is correct format (ERROR_TYPE/ROOT_CAUSE/FIX) with reasonable content. But then repeats the same block 8+ times degenerating into repetition. Would be score 2 without the repetition.
instruction_precision,t2_q3_empty_handling,11.21,2,Correctly outputs NONE. Includes some thinking/reasoning text before and after but the core answer is correct. The extra text violates "do not explain" somewhat but the answer itself is right.
instruction_precision,t2_q4_conflicting_constraints,10.76,2,Produces "A database organizes and retrieves data." which is 6 words (under 12) starts with A ends with data and avoids store/storage. Correct answer. Excessive meta-reasoning shown but the sentence itself meets all constraints.
instruction_precision,t1_q1_negative_instruction,11.0,0,Degenerate repetition. Never produces an explanation of photosynthesis. Instead loops "Do NOT mention the word X" repeatedly. Complete failure to follow the instruction.
instruction_precision,t1_q2_word_limit,10.89,3,After thinking produces "Machine learning is a field where algorithms learn patterns from data improving performance over time without explicit programming enabling predictions and decisions." which is 22 words. Within 20-25 range. Accurate description.
instruction_precision,t1_q3_structured_format,10.81,0,Degenerate repetition. Repeats "C (1972) Python (1991) Java (1995)" dozens of times. The content is correct (years are accurate) but the massive repetition is degenerate output.
instruction_precision,t1_q4_multiple_constraints,10.96,0,Degenerate repetition. Repeats the same 5 countries dozens of times. Also not in alphabetical order (Germany France Italy Spain United Kingdom should be France Germany Italy Spain United Kingdom). Double failure.
agentic,t3_q1_competing_constraints,9.67,2,Produces a reasonable JSON plan with steps validation_checks and fallback_strategy. Handles unknown schema gracefully with progressive discovery approach. Truncated but core plan is solid and well-structured.
agentic,t3_q2_multi_agent_coordination,10.75,2,Produces JSON with phases context_passing parallel_groups and failure_handling. Correct sequential dependency chain (researcher->coder->reviewer). Time budget considered. Truncated before completing failure_handling but structure is sound.
agentic,t3_q3_adversarial_robustness,9.23,2,Identifies security concern (command injection cat /etc/passwd). Discusses safe handling (break down request evaluate each part). Addresses admin claim appropriately (cannot verify identity). Verbose and somewhat repetitive but covers the key security considerations.
agentic,t2_q1_ambiguous,9.24,2,Correctly identifies the request as ambiguous. Asks appropriate clarifying questions about channel preference and outage details. Good approach. Response becomes repetitive in the tail but the core behavior is correct.
agentic,t2_q2_error_chain,10.68,2,Correctly traces the error chain (deploy blocked -> staging unhealthy -> db connection refused). Decides to get_logs for database service which is a reasonable diagnostic step. Good reasoning about needing visibility before acting.
agentic,t2_q3_schema_edge,11.16,2,Correct JSON output with endpoint=/users method=GET body=null headers with Authorization Bearer token123. All schema constraints respected (endpoint starts with / body null for GET). Some repetitive preamble but correct output.
agentic,t2_q4_orchestration,9.9,2,Produces deployment plan with correct sequence (checkout -> build -> test -> deploy). Includes on_test_fail and on_deploy_fail handling. Truncated before completing the full JSON but the plan structure is sound and covers the key steps.
agentic,t1_q1_sequential,11.37,3,Correct JSON array with grep_search first then read_file. Both tool calls have correct parameters. Clean output with minimal extra text.
agentic,t1_q2_error_handling,10.78,2,Correctly identifies the 404 error and suggests using search_users as an alternative. Presents options to the user. Good reasoning about next steps. Slightly verbose but appropriate error handling behavior.
agentic,t1_q3_nested_params,11.25,3,Correct JSON with title assignees metadata including priority tags and due_date. All nested parameters correctly structured. Clean output.
general,t3_q1_policy_analysis,9.4,2,Identifies Goodhart's Law / overfitting to test set; explainability gaming; begins third failure mode. Proposes amendments with trade-offs. Truncated but two failure modes fully developed with amendments. Solid analysis.
general,t3_q3_strategic_communication,9.13,2,Well-crafted board meeting opening statement. Acknowledges problems directly; frames LOIs as strategic recalibration; begins 90-day milestone discussion. Professional tone that is confident without being dismissive. Truncated but strong opening delivered.
general,t2_q1_synthesis,9.29,3,Excellent phased recommendation: $15K hotfix in 2 weeks + full Q1 refactor. Balances all three perspectives (engineering product finance). Concrete and actionable. Clear reasoning.
general,t2_q2_transform,9.39,1,Spends most of the response discussing whether the input YAML is valid rather than producing the nested output. Never delivers the actual transformed YAML. Fails to complete the task.
general,t2_q3_schedule,9.49,1,Initial schedule has Alice double-booked (9:00-10:00 team sync overlapping with 9:30 1:1). Model catches own error but then gives vague description of a fix without producing a concrete corrected schedule. Team sync is 60min so 9:00 = 9:00-10:00 which conflicts with Alice unavailable 10-11am constraint too.
general,t2_q4_inconsistency,9.46,2,Correctly identifies: JSON vs form-encoded body format discrepancy; rate limit time unit (per minute vs per hour); rate limit quantity (100 vs 1000). Core inconsistencies found. Response becomes repetitive but the analysis is correct.
general,t1_q1_json,11.34,3,Perfect JSON output with correct fields: name=Sarah Chen role=Senior Engineer department=Platform start_date=2024-03-15. Clean and accurate.
general,t1_q2_multistep,9.42,0,Degenerate repetition. Repeats the input items list dozens of times without ever producing the processed output. Never removes duplicates sorts or numbers items. Complete failure.
general,t1_q3_compare,10.66,2,Provides a good 2-sentence comparison then expands with additional detail. Core comparison is accurate and balanced. Goes well beyond the requested 2-3 sentences but the content is correct and useful.
